{"geometry":{"compatibleDefinitionDigest":"662cd11f25133754db47e7cda3e874314fd7268e694f5ad35bb9586f3fcaf9d7","explicitCubeTracks":{"path-0":{"angle":-1.5707963267948966,"axis":[0,0,-1]},"path-1":{"angle":1.5707963267948966,"axis":[0,0,-1]},"path-10":{"angle":-1.5707963267948966,"axis":[0,1,0]},"path-11":{"angle":1.5707963267948966,"axis":[0,1,0]},"path-2":{"angle":-1.5707963267948966,"axis":[0,-1,0]},"path-3":{"angle":1.5707963267948966,"axis":[0,-1,0]},"path-4":{"angle":-1.5707963267948966,"axis":[0,0,1]},"path-5":{"angle":1.5707963267948966,"axis":[0,0,1]},"path-6":{"angle":-1.5707963267948966,"axis":[-1,0,0]},"path-7":{"angle":1.5707963267948966,"axis":[-1,0,0]},"path-8":{"angle":-1.5707963267948966,"axis":[1,0,0]},"path-9":{"angle":1.5707963267948966,"axis":[1,0,0]}},"id":"cube3-cube-port-diagram-v1","kind":"cube-port-diagram","requiredCapabilities":["explicit-cube-tracks","rigid-transforms","triangle-meshes"],"schemaVersion":1},"payloadVersion":1,"pieceKinds":["rigid","rigid","rigid","rigid","rigid","rigid","rigid","rigid","rigid","rigid","rigid","rigid","rigid","rigid","rigid","rigid","rigid","rigid","rigid","rigid","rigid","rigid","rigid","rigid","rigid","rigid"],"requestBindings":[{"group":"group-0","pathId":"path-0","resources":[0,1,2,4,5,6,18,19,20]},{"group":"group-0","pathId":"path-1","resources":[0,1,2,4,5,6,18,19,20]},{"group":"group-1","pathId":"path-2","resources":[3,4,5,6,7,8,9,10,11]},{"group":"group-1","pathId":"path-3","resources":[3,4,5,6,7,8,9,10,11]},{"group":"group-2","pathId":"path-4","resources":[7,8,9,12,13,14,21,22,23]},{"group":"group-2","pathId":"path-5","resources":[7,8,9,12,13,14,21,22,23]},{"group":"group-3","pathId":"path-6","resources":[1,5,8,10,13,15,19,22,24]},{"group":"group-3","pathId":"path-7","resources":[1,5,8,10,13,15,19,22,24]},{"group":"group-4","pathId":"path-8","resources":[2,6,9,11,14,16,20,23,25]},{"group":"group-4","pathId":"path-9","resources":[2,6,9,11,14,16,20,23,25]},{"group":"group-5","pathId":"path-10","resources":[17,18,19,20,21,22,23,24,25]},{"group":"group-5","pathId":"path-11","resources":[17,18,19,20,21,22,23,24,25]}]}